{"action":"start","attempt":"sha256:6099f35b21f6cc7b16a430369d7d03e4173704e3ee866edc9ea8d3709ef1aa8a","effect_index":0,"elapsed_ms":28,"execution_lock_timeout_ms":5000,"expected_active_state":"inactive","expected_unit_file_state":"disabled","finished_at_unix_ms":1788776137855,"job_path":"/org/freedesktop/systemd1/job/1530","job_result":"done","job_timeout_ms":30000,"live_machine_identity":"bb1aa44ac2984af89f6d3ac865cd0004","marker":"sha256:0457cbd8ff5db9a7d95eb2e2a1c72bf2c1055f8a8367a1c8201e11a1ef0a1d04","messages":[{"bytes":[108,2,1,1,37,0,0,0,105,10,0,0,45,0,0,0,5,1,117,0,2,0,0,0,6,1,115,0,5,0,0,0,58,49,46,52,56,0,0,0,8,1,103,0,1,115,0,0,7,1,115,0,4,0,0,0,58,49,46,51,0,0,0,0,32,0,0,0,98,98,49,97,97,52,52,97,99,50,57,56,52,97,102,56,57,102,54,100,51,97,99,56,54,53,99,100,48,48,48,52,0],"elapsed_ms":1,"kind":"get_machine_id_reply"},{"bytes":[108,2,1,1,0,0,0,0,109,10,0,0,37,0,0,0,5,1,117,0,3,0,0,0,6,1,115,0,5,0,0,0,58,49,46,52,56,0,0,0,7,1,115,0,4,0,0,0,58,49,46,51,0,0,0,0],"elapsed_ms":1,"kind":"ref_unit_reply"},{"bytes":[108,2,1,1,83,0,0,0,118,10,0,0,45,0,0,0,5,1,117,0,4,0,0,0,6,1,115,0,5,0,0,0,58,49,46,52,56,0,0,0,8,1,103,0,1,111,0,0,7,1,115,0,4,0,0,0,58,49,46,51,0,0,0,0,78,0,0,0,47,111,114,103,47,102,114,101,101,100,101,115,107,116,111,112,47,115,121,115,116,101,109,100,49,47,117,110,105,116,47,99,111,110,115,116,101,108,108,97,116,105,111,110,95,50,100,98,101,116,97,95,50,100,104,116,116,112,95,50,100,102,105,120,116,117,114,101,95,50,101,115,101,114,118,105,99,101,0],"elapsed_ms":2,"kind":"get_unit_reply"},{"bytes":[108,2,1,1,17,0,0,0,119,10,0,0,45,0,0,0,5,1,117,0,5,0,0,0,6,1,115,0,5,0,0,0,58,49,46,52,56,0,0,0,8,1,103,0,1,118,0,0,7,1,115,0,4,0,0,0,58,49,46,51,0,0,0,0,1,115,0,0,8,0,0,0,105,110,97,99,116,105,118,101,0],"elapsed_ms":2,"kind":"pre_active_state_reply"},{"bytes":[108,2,1,1,13,0,0,0,120,10,0,0,45,0,0,0,5,1,117,0,6,0,0,0,6,1,115,0,5,0,0,0,58,49,46,52,56,0,0,0,8,1,103,0,1,115,0,0,7,1,115,0,4,0,0,0,58,49,46,51,0,0,0,0,8,0,0,0,100,105,115,97,98,108,101,100,0],"elapsed_ms":4,"kind":"pre_unit_file_state_reply"},{"bytes":[108,2,1,1,39,0,0,0,127,10,0,0,45,0,0,0,5,1,117,0,10,0,0,0,6,1,115,0,5,0,0,0,58,49,46,52,56,0,0,0,8,1,103,0,1,111,0,0,7,1,115,0,4,0,0,0,58,49,46,51,0,0,0,0,34,0,0,0,47,111,114,103,47,102,114,101,101,100,101,115,107,116,111,112,47,115,121,115,116,101,109,100,49,47,106,111,98,47,49,53,51,48,0],"elapsed_ms":6,"kind":"start_unit_reply"},{"bytes":[108,4,1,1,97,0,0,0,132,10,0,0,141,0,0,0,1,1,111,0,25,0,0,0,47,111,114,103,47,102,114,101,101,100,101,115,107,116,111,112,47,115,121,115,116,101,109,100,49,0,0,0,0,0,0,0,2,1,115,0,32,0,0,0,111,114,103,46,102,114,101,101,100,101,115,107,116,111,112,46,115,121,115,116,101,109,100,49,46,77,97,110,97,103,101,114,0,0,0,0,0,0,0,0,3,1,115,0,10,0,0,0,74,111,98,82,101,109,111,118,101,100,0,0,0,0,0,0,8,1,103,0,4,117,111,115,115,0,0,0,0,0,0,0,7,1,115,0,4,0,0,0,58,49,46,51,0,0,0,0,250,5,0,0,34,0,0,0,47,111,114,103,47,102,114,101,101,100,101,115,107,116,111,112,47,115,121,115,116,101,109,100,49,47,106,111,98,47,49,53,51,48,0,0,39,0,0,0,99,111,110,115,116,101,108,108,97,116,105,111,110,45,98,101,116,97,45,104,116,116,112,45,102,105,120,116,117,114,101,46,115,101,114,118,105,99,101,0,4,0,0,0,100,111,110,101,0],"elapsed_ms":25,"kind":"job_removed_signal"},{"bytes":[108,2,1,1,15,0,0,0,136,10,0,0,45,0,0,0,5,1,117,0,11,0,0,0,6,1,115,0,5,0,0,0,58,49,46,52,56,0,0,0,8,1,103,0,1,118,0,0,7,1,115,0,4,0,0,0,58,49,46,51,0,0,0,0,1,115,0,0,6,0,0,0,97,99,116,105,118,101,0],"elapsed_ms":25,"kind":"post_active_state_reply"},{"bytes":[108,2,1,1,13,0,0,0,137,10,0,0,45,0,0,0,5,1,117,0,12,0,0,0,6,1,115,0,5,0,0,0,58,49,46,52,56,0,0,0,8,1,103,0,1,115,0,0,7,1,115,0,4,0,0,0,58,49,46,51,0,0,0,0,8,0,0,0,100,105,115,97,98,108,101,100,0],"elapsed_ms":28,"kind":"post_unit_file_state_reply"}],"outcome_class":"success","outcome_code":"start_unit_completed","previous_active_state":"inactive","previous_unit_file_state":"disabled","resulting_active_state":"active","resulting_unit_file_state":"disabled","schema":"ag-effectd.systemd-dbus-evidence/v1","started_at_unix_ms":1788776137826,"systemd_machine_identity":"bb1aa44ac2984af89f6d3ac865cd0004","unit":"constellation-beta-http-fixture.service","unit_object_path":"/org/freedesktop/systemd1/unit/constellation_2dbeta_2dhttp_2dfixture_2eservice","work":"sha256:976d8ebe16a7423a42617e21952aa4578f3284650850cb7ec246897260bc4027"}